{
  "format": "s1quest_curriculum_microtasks",
  "version": 1,
  "created": "2026-10-16",
  "purpose": "Catalogue de micro-missions du semestre 1 MI basé sur les PDF de si/S1, à vérifier avant intégration définitive.",
  "privacy": {
    "contains_private_urls": false,
    "drive_links_excluded_intentionally": true,
    "no_public_repo_private_file_ids": true
  },
  "rules": {
    "no_precompleted_tasks": true,
    "status_storage": "Separate personal-progress state, versioned migration required",
    "progress_cours": "completed leaf course units / total configured leaf course units",
    "progress_td": "completed distinct required exercises / total configured required TD exercises; optional exercises counted separately",
    "progress_tp": "completed distinct TP exercises / total configured TP exercises",
    "chapter_progress": "course leaf units only; parent chapter never counts twice",
    "cross_chapter_td": "One canonical exercise ID regardless of how many chapters link to it",
    "recommended_states": [
      "non_commencé",
      "en_cours",
      "à_revoir",
      "maîtrisé"
    ],
    "empty_module": "À configurer; excluded from whole semester percentage",
    "source_link_policy": "Link only when the owner explicitly authorizes publication; private resources require authenticated backend."
  },
  "sources": {
    "analyse1:cours:1": {
      "filename": "analyse chapter 1.pdf",
      "module": "analyse1",
      "section": "cours",
      "pdf_pages": 54,
      "content_inspected": true,
      "visibility": "private_by_default",
      "drive_url": null
    },
    "analyse1:cours:2": {
      "filename": "analyse chapter 2.pdf",
      "module": "analyse1",
      "section": "cours",
      "pdf_pages": 69,
      "content_inspected": true,
      "visibility": "private_by_default",
      "drive_url": null
    },
    "analyse1:cours:3": {
      "filename": "analyse chapter 3.pdf",
      "module": "analyse1",
      "section": "cours",
      "pdf_pages": 74,
      "content_inspected": true,
      "visibility": "private_by_default",
      "drive_url": null
    },
    "analyse1:cours:4": {
      "filename": "analyse chapter 4.pdf",
      "module": "analyse1",
      "section": "cours",
      "pdf_pages": 63,
      "content_inspected": true,
      "visibility": "private_by_default",
      "drive_url": null
    },
    "analyse1:td:1": {
      "filename": "analyse TD1 .pdf",
      "module": "analyse1",
      "section": "td",
      "pdf_pages": 18,
      "content_inspected": true,
      "visibility": "private_by_default",
      "drive_url": null,
      "notes": "TD1 contains optional exercises 11-17"
    },
    "analyse1:td:2": {
      "filename": "analyse TD2.pdf",
      "module": "analyse1",
      "section": "td",
      "pdf_pages": 20,
      "content_inspected": true,
      "visibility": "private_by_default",
      "drive_url": null
    },
    "analyse1:td:3": {
      "filename": "analyse TD3.pdf",
      "module": "analyse1",
      "section": "td",
      "pdf_pages": 6,
      "content_inspected": true,
      "visibility": "private_by_default",
      "drive_url": null
    },
    "algebre1:cours:1": {
      "filename": "chapitre 1.pdf",
      "module": "algebre1",
      "section": "cours",
      "pdf_pages": 13,
      "content_inspected": true,
      "visibility": "private_by_default",
      "drive_url": null
    },
    "algebre1:cours:2": {
      "filename": "chapitre 2.pdf",
      "module": "algebre1",
      "section": "cours",
      "pdf_pages": 24,
      "content_inspected": true,
      "visibility": "private_by_default",
      "drive_url": null
    },
    "algebre1:cours:3": {
      "filename": "chapitre 3.pdf",
      "module": "algebre1",
      "section": "cours",
      "pdf_pages": 20,
      "content_inspected": true,
      "visibility": "private_by_default",
      "drive_url": null
    },
    "algebre1:td:1": {
      "filename": "TD 1.pdf",
      "module": "algebre1",
      "section": "td",
      "pdf_pages": 2,
      "content_inspected": true,
      "visibility": "private_by_default",
      "drive_url": null
    },
    "algebre1:td:2": {
      "filename": "TD 2.pdf",
      "module": "algebre1",
      "section": "td",
      "pdf_pages": 3,
      "content_inspected": true,
      "visibility": "private_by_default",
      "drive_url": null
    },
    "algebre1:td:3": {
      "filename": "TD 3.pdf",
      "module": "algebre1",
      "section": "td",
      "pdf_pages": 2,
      "content_inspected": true,
      "visibility": "private_by_default",
      "drive_url": null
    },
    "algebre1:td:4": {
      "filename": "TD 4.pdf",
      "module": "algebre1",
      "section": "td",
      "pdf_pages": 2,
      "content_inspected": true,
      "visibility": "private_by_default",
      "drive_url": null
    },
    "algebre2:cours:1": {
      "filename": "1. Cours Algebre 2 (complet).pdf",
      "module": "algebre2",
      "section": "cours",
      "pdf_pages": 56,
      "content_inspected": true,
      "visibility": "private_by_default",
      "drive_url": null
    },
    "algebre2:cours:2": {
      "filename": "1. Cours Algebre 2 (complet).pdf",
      "module": "algebre2",
      "section": "cours",
      "pdf_pages": 56,
      "content_inspected": true,
      "visibility": "private_by_default",
      "drive_url": null
    },
    "algebre2:cours:3": {
      "filename": "1. Cours Algebre 2 (complet).pdf",
      "module": "algebre2",
      "section": "cours",
      "pdf_pages": 56,
      "content_inspected": true,
      "visibility": "private_by_default",
      "drive_url": null
    },
    "algebre2:td:1": {
      "filename": "TD1.pdf",
      "module": "algebre2",
      "section": "td",
      "pdf_pages": 2,
      "content_inspected": true,
      "visibility": "private_by_default",
      "drive_url": null,
      "notes": "Photographed exercise series; numbering read from rendered pages"
    },
    "algebre2:td:2": {
      "filename": "TD2.pdf",
      "module": "algebre2",
      "section": "td",
      "pdf_pages": 2,
      "content_inspected": true,
      "visibility": "private_by_default",
      "drive_url": null,
      "notes": "Photographed exercise series; numbering read from rendered pages"
    },
    "algebre2:td:3": {
      "filename": "TD3.pdf",
      "module": "algebre2",
      "section": "td",
      "pdf_pages": 2,
      "content_inspected": true,
      "visibility": "private_by_default",
      "drive_url": null,
      "notes": "Photographed exercise series; numbering read from rendered pages"
    },
    "mecanique:cours:1": {
      "filename": "MDPM-chapitre1.pdf",
      "module": "mecanique",
      "section": "cours",
      "pdf_pages": 19,
      "content_inspected": true,
      "visibility": "private_by_default",
      "drive_url": null
    },
    "mecanique:cours:2": {
      "filename": "MDPM-chapitre2-chapitre3.pdf",
      "module": "mecanique",
      "section": "cours",
      "pdf_pages": 22,
      "content_inspected": true,
      "visibility": "private_by_default",
      "drive_url": null
    },
    "mecanique:cours:3": {
      "filename": "MDPM-chapitre2-chapitre3.pdf",
      "module": "mecanique",
      "section": "cours",
      "pdf_pages": 22,
      "content_inspected": true,
      "visibility": "private_by_default",
      "drive_url": null
    },
    "mecanique:cours:4": {
      "filename": "MDPM-chapitre4.pdf",
      "module": "mecanique",
      "section": "cours",
      "pdf_pages": 14,
      "content_inspected": true,
      "visibility": "private_by_default",
      "drive_url": null
    },
    "mecanique:cours:5": {
      "filename": "MDPM-chapitre5.pdf",
      "module": "mecanique",
      "section": "cours",
      "pdf_pages": 6,
      "content_inspected": true,
      "visibility": "private_by_default",
      "drive_url": null,
      "notes": "IMPORTANT: The actual PDF says CHAPITRE 6 although the file is named chapitre5.pdf"
    },
    "mecanique:td:1": {
      "filename": "MDPM-serie1.pdf",
      "module": "mecanique",
      "section": "td",
      "pdf_pages": 9,
      "content_inspected": true,
      "visibility": "private_by_default",
      "drive_url": null
    },
    "mecanique:td:2": {
      "filename": "MDPM-serie2.pdf",
      "module": "mecanique",
      "section": "td",
      "pdf_pages": 10,
      "content_inspected": true,
      "visibility": "private_by_default",
      "drive_url": null
    },
    "mecanique:td:3": {
      "filename": "MDPM-serie3.pdf",
      "module": "mecanique",
      "section": "td",
      "pdf_pages": 6,
      "content_inspected": true,
      "visibility": "private_by_default",
      "drive_url": null
    },
    "mecanique:td:4": {
      "filename": "MDPM-serie4.pdf",
      "module": "mecanique",
      "section": "td",
      "pdf_pages": 12,
      "content_inspected": true,
      "visibility": "private_by_default",
      "drive_url": null
    },
    "mecanique:td:5": {
      "filename": "MDPM-serie5.pdf",
      "module": "mecanique",
      "section": "td",
      "pdf_pages": 8,
      "content_inspected": true,
      "visibility": "private_by_default",
      "drive_url": null
    },
    "informatique1:cours:1": {
      "filename": "PART1.pdf",
      "module": "informatique1",
      "section": "cours",
      "pdf_pages": 29,
      "content_inspected": true,
      "visibility": "private_by_default",
      "drive_url": null
    },
    "informatique1:cours:2": {
      "filename": "PART2.pdf",
      "module": "informatique1",
      "section": "cours",
      "pdf_pages": 15,
      "content_inspected": true,
      "visibility": "private_by_default",
      "drive_url": null
    },
    "informatique1:cours:3": {
      "filename": "PART3.pdf",
      "module": "informatique1",
      "section": "cours",
      "pdf_pages": 17,
      "content_inspected": true,
      "visibility": "private_by_default",
      "drive_url": null
    },
    "informatique1:cours:4": {
      "filename": "PART4.pdf",
      "module": "informatique1",
      "section": "cours",
      "pdf_pages": 11,